{
  "bloodbath": {
    "title": "The Lid Opens",
    "description": "As the tiny survivors stand on their crouton platforms, the refrigerator door swings open.",
    "color": "#4a90d9",
    "nonfatal": [
      {
        "msg": "{0} grabs a crumb and retreats behind the ketchup bottle.",
        "tributes": 1
      },
      {
        "msg": "{0} and {1} fight over {food_any}. {0} gives up and retreats.",
        "tributes": 2
      },
      {
        "msg": "{0} finds {weapon_any}.",
        "tributes": 1
      },
      {
        "msg": "{0} slides down a condensation droplet to safety.",
        "tributes": 1
      },
      {
        "msg": "{0} takes {weapon_any} from the butter compartment.",
        "tributes": 1
      },
      {
        "msg": "{0} rips {weapon_any} out of {1}'s hands.",
        "tributes": 2
      },
      {
        "msg": "{0} finds a puddle of {liquid_any}.",
        "tributes": 1
      },
      {
        "msg": "{0} hides inside an empty egg carton.",
        "tributes": 1
      },
      {
        "msg": "{0} gathers as much {food_any} as they can carry.",
        "tributes": 1
      },
      {
        "msg": "{0} finds a glob of {food_any}.",
        "tributes": 1
      },
      {
        "msg": "{0} clutches a thimble of {liquid_any} and runs away.",
        "tributes": 1
      },
      {
        "msg": "{0}, {1}, and {2} work together to raid the cheese drawer.",
        "tributes": 3
      },
      {
        "msg": "{0} runs away with a twist-tie and a rubber band.",
        "tributes": 1
      },
      {
        "msg": "{0} snatches a drop of {liquid_any} and a napkin scrap.",
        "tributes": 1
      },
      {
        "msg": "{0} finds some {food_bad} but takes it anyway.",
        "tributes": 1
      },
      {
        "msg": "{0} grabs an empty bottle cap, not realizing it's useless.",
        "tributes": 1
      },
      {
        "msg": "{0} breaks {1}'s nose for a crumb of {food_any}.",
        "tributes": 2
      },
      {
        "msg": "{0}, {1}, {2}, and {3} share everything they gathered before scattering.",
        "tributes": 4
      },
      {
        "msg": "{0} receives {weapon_any} from inside a forgotten takeout container.",
        "tributes": 1
      },
      {
        "msg": "{0} grabs some {food_any} while {1} gets a paperclip.",
        "tributes": 2
      },
      {
        "msg": "{0} scares {1} away from the meat drawer.",
        "tributes": 2
      },
      {
        "msg": "{0} grabs a piece of aluminum foil as a shield.",
        "tributes": 1
      },
      {
        "msg": "{0} snatches {weapon_any}.",
        "tributes": 1
      },
      {
        "msg": "{0} discovers a secret passage behind the pickle jar.",
        "tributes": 1
      },
      {
        "msg": "{0} befriends a confused fruit fly.",
        "tributes": 1
      },
      {
        "msg": "{0} turns out to be {1}, covered in mustard as a disguise!",
        "tributes": 2
      },
      {
        "msg": "{0} finds {weapon_cold} and immediately feels more confident.",
        "tributes": 1
      },
      {
        "msg": "{0} grabs {weapon_chemical} from behind a jar of pickles.",
        "tributes": 1
      },
      {
        "msg": "{0}, {1}, {2}, and {3} form a temporary alliance to secure the top shelf.",
        "tributes": 4
      },
      {
        "msg": "{0} dives into a produce bag and disappears from sight.",
        "tributes": 1
      },
      {
        "msg": "{0} squeezes under the door seal and finds a hidden stash.",
        "tributes": 1
      },
      {
        "msg": "{0} and {1} discover {weapon_explosive} at the same time. They agree to share... for now.",
        "tributes": 2
      }
    ],
    "fatal": [
      {
        "msg": "{0} steps off their crouton platform too soon and falls into {liquid_any}.",
        "tributes": 1,
        "killed": [0],
        "killer": null,
        "order": -1
      },
      {
        "msg": "{0} is crushed by falling {food_any}.",
        "tributes": 1,
        "killed": [0],
        "killer": null
      },
      {
        "msg": "{0} accidentally steps into a glob of {liquid_bad}.",
        "tributes": 1,
        "killed": [0],
        "killer": null
      },
      {
        "msg": "{0} cannot handle the cold and succumbs to hypothermia.",
        "tributes": 1,
        "killed": [0],
        "killer": null
      },
      {
        "msg": "{0} is swept away by a sudden condensation flood.",
        "tributes": 1,
        "killed": [0],
        "killer": null
      },
      {
        "msg": "{0} slips on {hazard_slippery} and falls off the shelf.",
        "tributes": 1,
        "killed": [0],
        "killer": null
      },
      {
        "msg": "{0} stabs {1} with {weapon_piercing}.",
        "tributes": 2,
        "killed": [1],
        "killer": [0]
      },
      {
        "msg": "{0} finds {1} hiding in the vegetable crisper and eliminates them.",
        "tributes": 2,
        "killed": [1],
        "killer": [0]
      },
      {
        "msg": "{0} finds {1} hiding in the vegetable crisper, but {1} strikes first.",
        "tributes": 2,
        "killed": [0],
        "killer": [1]
      },
      {
        "msg": "{0} pushes {1} into the path of {weapon_blunt}.",
        "tributes": 2,
        "killed": [1],
        "killer": [0]
      },
      {
        "msg": "{0} drowns {1} in a puddle of {liquid_neutral}.",
        "tributes": 2,
        "killed": [1],
        "killer": [0]
      },
      {
        "msg": "{0} tries to kill {1} with {weapon_projectile} but it ricochets off a jar.",
        "tributes": 2,
        "killed": [0],
        "killer": [0]
      },
      {
        "msg": "{0} accidentally knocks over a bottle of {liquid_bad}. {1}, {2}, and {3} are swept away in the flood.",
        "tributes": 4,
        "killed": [1, 2, 3],
        "killer": [0],
        "weight": 0.5
      },
      {
        "msg": "{0} triggers an avalanche of {food_neutral}, killing themselves, {1}, and {2}.",
        "tributes": 3,
        "killed": [0, 1, 2],
        "killer": null,
        "weight": 0.6
      },
      {
        "msg": "{0} uses {weapon_explosive} without understanding the consequences. {1} and {2} are caught in the blast.",
        "tributes": 3,
        "killed": [0, 1, 2],
        "killer": null,
        "weight": 0.6
      },
      {
        "msg": "{0} hits {1} with {weapon_fire}. The screaming is brief.",
        "tributes": 2,
        "killed": [1],
        "killer": [0]
      },
      {
        "msg": "A bottle of {liquid_neutral} rolls across the shelf, crushing {0} and {1}.",
        "tributes": 2,
        "killed": [0, 1],
        "killer": null,
        "weight": 0.8
      },
      {
        "msg": "{0} shoves {1} into a cascade of falling condiment packets.",
        "tributes": 2,
        "killed": [1],
        "killer": [0]
      },
      {
        "msg": "{0} panics and throws {weapon_chemical} wildly. It hits {1} directly.",
        "tributes": 2,
        "killed": [1],
        "killer": [0]
      }
    ]
  },
  "day": {
    "title": "Day {0}",
    "description": "The survivors forage through the cold shelves.",
    "color": "#ffa500",
    "nonfatal": [
      {
        "msg": "{0} searches for supplies in {location_any}.",
        "tributes": 1
      },
      {
        "msg": "{0} and {1} form an alliance in {location_any}.",
        "tributes": 2
      },
      {
        "msg": "{0} marks a safe route with {food_any}.",
        "tributes": 1
      },
      {
        "msg": "{0} tends to their frostbite.",
        "tributes": 1
      },
      {
        "msg": "{0} and {1} share some {food_any}.",
        "tributes": 2
      },
      {
        "msg": "{0} sets up camp inside a hollowed-out bell pepper.",
        "tributes": 1
      },
      {
        "msg": "{0} explores the mysterious back of the fridge.",
        "tributes": 1
      },
      {
        "msg": "{0} and {1} work together to scale {container_any}.",
        "tributes": 2
      },
      {
        "msg": "{0} discovers a warm spot near the motor.",
        "tributes": 1
      },
      {
        "msg": "{0} crafts a sled from a butter wrapper.",
        "tributes": 1
      },
      {
        "msg": "{0} plants a toothpick flag on {container_any}.",
        "tributes": 1
      },
      {
        "msg": "{0} takes a nap inside {container_any}.",
        "tributes": 1
      },
      {
        "msg": "{0} collects {liquid_any} from condensation.",
        "tributes": 1
      },
      {
        "msg": "{0} and {1} debate whether the thing in the back is still edible.",
        "tributes": 2
      },
      {
        "msg": "{0}, {1}, and {2} build a shelter from toothpicks.",
        "tributes": 3
      },
      {
        "msg": "{0} finds forgotten {food_any} and reads the label like a prophecy.",
        "tributes": 1
      },
      {
        "msg": "{0} and {1} play cards using scraps of {food_any}.",
        "tributes": 2
      },
      {
        "msg": "{0} writes their will on a napkin scrap.",
        "tributes": 1
      },
      {
        "msg": "{0} discovers an ancient expiration date and has an existential crisis.",
        "tributes": 1
      },
      {
        "msg": "{0} catches and tames {creature_insect} for transportation.",
        "tributes": 1
      },
      {
        "msg": "{0} accidentally triggers the light. Everyone freezes.",
        "tributes": 1
      },
      {
        "msg": "{0} and {1} argue about which part of {location_any} is safest.",
        "tributes": 2
      },
      {
        "msg": "{0} mourns the loss of an ally by pouring out some {liquid_neutral}.",
        "tributes": 1
      },
      {
        "msg": "{0} rappels down the milk jug on a dental floss line.",
        "tributes": 1
      },
      {
        "msg": "{0} hears the ice maker rumble and wisely keeps their distance.",
        "tributes": 1
      },
      {
        "msg": "{0} crafts a grappling hook from a twist-tie and dental floss.",